{
  "schema_version": "course-archive-publish-request/v1",
  "binding_id": "content-history-primary",
  "course_id": "C-early-civilization",
  "release_id": "rel-01a2b3c4d5-0001",
  "expected_release_checksum": "106d696831803748f86f4e9c3428d14454b41da2bd2051ec5950134b3dd9eec8",
  "archive_id": "arc-f64b2d24a81a398212867020c4c40ae1",
  "expected_archive_checksum": "f64b2d24a81a398212867020c4c40ae1e01141b58ef70957bcfbe14a4085e940",
  "mode": "pull_request",
  "client_request_id": "request-dayu-archive-001",
  "change_summary": "提交大禹治水开发夹具，用于验证课程归档与审校流程。",
  "direct_commit_confirmed": false
}
